58,Riverside, California,"330,063","303,871",+8.62%,81.2 sq mi,210.3 km2,"3,999/sq mi","1,544/km2",81.23 sq mi (210.38 km2),0.31 sq mi (0.80 km2)  0.37%,UTC−8 (Pacific),City manager,"The nearest airport for commercial airline service is Ontario International Airport in Ontario, California. The Riverside Municipal Airport is an airport within Riverside's city limits, but does not have commercial airline service. It is primarily used for private aviation, and is also the location for the annual Riverside Air Show.
",http://riversideca.gov,"Riverside experiences a Mediterranean Csa influenced semi-arid (Köppen climate classification BSh) climate with hot, dry summers and mild, relatively wet winters. Normal monthly mean temperatures range from 54.5°F (12.5°C) in December to 79.4°F (26.3°C) in August.[32] On average, temperatures reach the freezing mark and 100°F (38°C) on 2.5 and 14.6days annually, respectively.[32] Record temperatures range from 18°F (−8°C) on January 15, 1911, up to 118°F (48°C) on July 17, 1925, June 16, 1917, and July 6, 2018.[33] On average, Riverside receives 10.33in (262mm) of precipitation annually, with measurable precipitation occurring on 30days, with most of it occurring in the winter and early spring, especially January through March, with February the wettest month.[34]
","/wiki/Riverside,_California"
59,Corpus Christi, Texas,"326,554","305,215",+6.99%,174.6 sq mi,452.2 km2,"1,866/sq mi",720/km2,174.6 sq mi (452 km2),329.0 sq mi (852 km2),UTC−6 (CST),Joe McComb,,http://www.cctexas.com,"The city has a humid subtropical climate, with hot, very humid summers and very short, mild winters. In November through February, the weather is the coolest. A noticeable warming trend occurs in March through April. The warmest part of the year is June through September, with August being the peak of summer. October in the city is very warm, but not as hot as the summer. Corpus Christi is very windy, with wind speeds often reaching to 25 miles per hour (40km/h; 11m/s) with gusts reaching more than 35 miles per hour (56km/h; 16m/s). The city’s record high temperature is 109°F (42.8°C), on September 5, 2000, and the hottest month August 2012 with an average of 88.3°F (31.3°C). Average night-time winter lows in January, the coldest month, are a little less than 50°F (10.0°C) and its record low is 11°F (−11.7°C) on February 12, 1899, and the coldest maximum 26°F (−3.3°C) on five occasions, the most recent being on January 30, 1951.[nb 1] Winter and early spring are generally dry, and average monthly precipitation is highest in September, when the threat from hurricanes and other tropical weather systems is greatest. The coolest month on record has been February 1905, with a mean of 45.6°F (7.6°C). In December 2004, the city experienced snowfall on Christmas Eve, the city’s largest recorded snowstorm at 4.4 inches (11.18cm). The snow melted the day after Christmas. Because of the uniqueness of the event, three separate books document the event, Snow, More Snow, and More Snow for Kids, all with the theme of the South Texas Christmas miracle.[19] The city experienced light snowfall a second time, on December 8, 2017, nearly 13 years later.
","/wiki/Corpus_Christi,_Texas"
60,Lexington, Kentucky,"323,780","295,803",+9.46%,283.6 sq mi,734.5 km2,"1,123/sq mi",434/km2,284.5 sq mi (736.9 km2),1.0 sq mi (2.6 km2),UTC−5 (EST),Linda Gorton,"Blue Grass Airport is Lexington's primary commercial airport. It provides about 13 nonstop flights and a total of 86 flights daily from its two runways. Four major airlines operate connection service at Blue Grass, including Allegiant Air, American Eagle, Delta Air Lines, and United Express.
",http://www.lexingtonky.gov,"Lexington is in the northern periphery of the humid subtropical climate zone,[16] with hot, humid summers, and moderately cold winters with occasional mild periods; it falls in USDA hardiness zone 6b.[17] The city and the surrounding Bluegrass region have four distinct seasons that include cool plateau breezes, moderate nights in the summer, and no prolonged periods of heat, cold, rain, wind, or snow. The monthly daily average temperature ranges from 32.9°F (0.5°C) in January to 76.2°F (24.6°C) in July, while the annual mean temperature is 55.5°F (13.1°C).[18] On average,  23days of 90°F (32°C)+ highs occur annually and 19days per winter where the high fails to rise above freezing occur.[18] Annual precipitation is 45.1 inches (1,150mm), with the late spring and summer being slightly wetter; snowfall averages 13.0 inches (33cm) per season.[19] Extreme temperatures range from −21°F (−29°C) on January 24, 1963, to 108°F (42°C) on July 10 and 15, 1936.[18]
","/wiki/Lexington,_Kentucky"
61,Stockton, California,"311,178","291,707",+6.67%,61.7 sq mi,159.8 km2,"4,977/sq mi","1,922/km2",61.67 sq mi (159.72 km2),3.08 sq mi (7.98 km2)  4.76%,UTC−8 (Pacific),Michael Tubbs,"Stockton is served by Stockton Metropolitan Airport, located on county land just south of city limits. The airport has been designated a Foreign Trade Zone and is mainly used by manufacturing and agricultural companies for shipping purposes. Since airline deregulation, passenger service has come and gone several times. Domestic service resumed on June 16, 2006, with service to Las Vegas by Allegiant Air.[121] The days of service/number of flights were expanded a few months later due to demand. Air service to Phoenix began in September 2007.
",http://www.stocktongov.com,"Stockton has a hot-summer Mediterranean climate (Köppen: Csa), with hot, dry summers and mild winters. In an average year, about eighty percent of the 13.8 inches or 350.5 millimetres of precipitation falls from October through April. Located in the Central Valley, the temperatures range is much greater than in the nearby Bay Area. Tule fog blankets the area during some winter days. Stockton lies in the fertile heart of the California Mediterranean climate prairie delta, about equidistant from the Pacific Ocean and the Sierra Nevada.[citation needed] The intermediate climate between the coast and the central valley gives a similar climate to Badajoz, Spain.[53]
","/wiki/Stockton,_California"
62,Henderson, Nevada,"310,390","257,729",+20.43%,104.7 sq mi,271.2 km2,"2,798/sq mi","1,080/km2",107.7 sq mi (279.0 km2),0.0 sq mi (0.0 km2),UTC−8 (PST),Debra March,,http://www.cityofhenderson.com,"Henderson is classified as having a hot desert climate (BWh) in the Köppen climate classification. It has mild winters and extremely hot summers. Snow can occasionally fall in the winter. The monsoon can bring storms in the summer, which can cause flash flooding and thunderstorms. The hottest month is July and the coldest month is December. On average there are 292 clear days per year.[9]
","/wiki/Henderson,_Nevada"
63,Saint Paul, Minnesota,"307,695","285,068",+7.94%,52.0 sq mi,134.7 km2,"5,815/sq mi","2,245/km2",51.97 sq mi (134.61 km2),4.20 sq mi (10.88 km2),UTC−6 (CST),Melvin Carter,"Saint Paul is served by the Minneapolis–Saint Paul International Airport (MSP), which sits on 3,400 acres (14km2)[147] southwest of the city on the west side of the Mississippi River between Minnesota State Highway 5, Interstate 494, Minnesota State Highway 77, and Minnesota State Highway 62. The airport serves three international, twelve domestic, seven charter, and four regional carriers[148] and is a hub and home base for Delta Air Lines, Mesaba Airlines and Sun Country Airlines.[149] Saint Paul is also served by the St. Paul Downtown Airport located just south of downtown, across the Mississippi River. The airport, also known as Holman Field, is a reliever airport run by the Metropolitan Airports Commission. The airport houses Minnesota's Air National Guard and is tailored to local corporate aviation.[150] There are three runways that serve about 100 resident aircraft and a flight training school. The Holman Field Administration Building and Riverside Hangar are on the National Register of Historic Places.[150]
",http://www.stpaul.gov/,"Saint Paul has a continental climate typical of the Upper Midwestern United States. Winters are frigid and snowy, while summers are warm to hot and humid. On the Köppen climate classification, Saint Paul falls in the hot summer humid continental climate zone (Dfa). The city experiences a full range of precipitation and related weather events, including snow, sleet, ice, rain, thunderstorms, tornadoes, and fog.[45]
","/wiki/Saint_Paul,_Minnesota"
64,St. Louis, Missouri,"302,838","319,294",−5.15%,62.0 sq mi,160.6 km2,"5,023/sq mi","1,939/km2",61.9 sq mi (160 km2),4.1 sq mi (11 km2),UTC−6 (CST),Lyda Krewson,"St. Louis is served by two passenger airports. St. Louis Lambert International Airport, owned and operated by the City of St. Louis, is 11 miles northwest of downtown along highway I-70 between I-170 and I-270 in St. Louis County. It is the largest and busiest airport in the state. In 2016, when the airport had more than 255 daily departures to about 90 domestic and international locations, it served more than 15 million passengers.[118] The airport serves as a focus hub city for Southwest Airlines; it was once a hub for Trans World Airlines and a focus-city for American Airlines and AmericanConnection.[118] The airport has two terminals with a total of five concourses. International flights and passengers use Terminal 2, whose lower level holds the Immigration and Customs gates. Passengers can move between the terminals on complimentary buses that run continuously, or via MetroLink for a fee. It was possible to walk between the terminals until Concourse D was closed in 2008.[119]
",http://stlouis-mo.gov,"The urban area of St. Louis has a damp subtropical climate (Köppen: Cfa); however, its metropolitan region even to the south may present a hot-summer humid continental climate (Dfa), which shows the effect of the urban heat island in the city. Without the presence of water bodies its winters may be colder than Boston, but its summers may be more similar to those of Lubbock, Texas than other areas to the east.[33] The city experiences hot, humid summers, and chilly to cold winters. It is subject to both cold Arctic air and hot, humid tropical air from the Gulf of Mexico. The average annual temperature recorded at nearby Lambert–St. Louis International Airport, is 57.1°F (13.9°C). Both 100 and 0°F (38 and −18°C) temperatures can be seen on an average 2 or 3 days per year.[34] Average annual precipitation is about 41.0 inches (1,040mm),[34] but annual precipitation has ranged from 20.59in (523mm) in 1953 to 61.24in (1,555mm) in 2015.[35]
",/wiki/St._Louis
65,Cincinnati, Ohio,"302,605","296,943",+1.91%,77.4 sq mi,200.5 km2,"3,860/sq mi","1,490/km2",201.86 km2 (77.94 sq mi),4.14 km2 (1.60 sq mi),UTC−5 (EST),John Cranley,,http://cincinnati-oh.gov,"Cincinnati is at the southern limit of the humid continental climate zone (Köppen: Dfa).[96] Summers are warm to hot and humid, with significant rainfall in each month and highs reaching 90°F (32°C) or above on 21 days per year, often with high dew points and humidity. July is the warmest month, with a daily average temperature of 75.9°F (24.4°C).[97]
",/wiki/Cincinnati
66,Pittsburgh, Pennsylvania,"301,048","305,704",−1.52%,55.4 sq mi,143.5 km2,"5,481/sq mi","2,116/km2",55.38 sq mi (143.42 km2),2.97 sq mi (7.69 km2)  4.8%,UTC−5 (Eastern Standard Time),Bill Peduto,"Pittsburgh International Airport and Arnold Palmer Regional Airport provide commercial passenger service to the metropolitan area.
",http://www.pittsburghpa.gov/,"Pittsburgh lies in the humid continental climate zone (Köppen Dfa).[61] The city and river valleys lie in the USDA plant hardiness zone 6b while higher elevated areas lie in zone 6a.[62] The area has four distinct seasons: winters are cold, cloudy, and moderately snowy, springs and falls generally mild with moderate levels of sunshine, and summers warm and humid. As measured by percent possible sunshine, summer is by far the sunniest season.[63]
",/wiki/Pittsburgh
67,Greensboro, North Carolina,"294,722","269,666",+9.29%,128.3 sq mi,332.3 km2,"2,237/sq mi",864/km2,126.5 sq mi (327.7 km2),5.3 sq mi (13.7 km2),UTC−5 (EST),Nancy B. Vaughan,,http://www.greensboro-nc.gov,"Greensboro, like much of the southeastern United States, has a humid subtropical climate (Köppen Cfa), with four distinct seasons. Winters are short and generally cool, with a January daily average of 38.9°F (3.8°C). On average, there are 75nights per year that drop to or below freezing,[a] and 4.3days that fail to rise above freezing.[40][b] Measurable snowfall occurs nearly every winter, and accumulates to a normal of 7.5 inches (19.1cm), usually in January and February and occasionally December and March; the actual amount may vary considerably from winter to winter.[c] Cold-air damming (CAD) can facilitate  freezing rain, often making it a more pressing concern than snow. Summers are hot and humid, with a daily average in July of 78.5°F (25.8°C). There is an average 32days per year with highs at or above 90°F (32°C), but, as in much of the Piedmont South, 100°F (38°C)+ readings are uncommon.[40] Autumn is similar to spring in temperature but has fewer days of rainfall and less total rainfall. Extremes in temperature have ranged from −8°F (−22°C) on January 21, 1985, up to 104°F (40°C), on July 17, 1914.
","/wiki/Greensboro,_North_Carolina"
68,Anchorage, Alaska,"291,538","291,826",−0.10%,"1,706.6 sq mi","4,420.1 km2",175/sq mi,68/km2,"1,706.61 sq mi (4,420.09 km2)",256.00 sq mi (663.04 km2),UTC-9 (AKST),Ethan Berkowitz,,http://www.muni.org/,"Anchorage has a subarctic climate (the Köppen climate classification is Dfc) but with strong maritime influences that lead to a relatively moderate climate.[30] Most of its precipitation falls in late summer. Average daytime summer temperatures range from approximately 55 to 78°F (13 to 26°C); average daytime winter temperatures are about 5 to 30°F (−15.0 to −1.1°C). Anchorage has a frost-free growing season that averages slightly over 101 days. According to local folklore, when a native plant called fireweed goes to seed after a full bloom, the first snowfall of winter is 6 weeks away.[31]
","/wiki/Anchorage,_Alaska"
69,Plano, Texas,"288,061","259,841",+10.86%,71.7 sq mi,185.7 km2,"3,990/sq mi","1,540/km2",71.6 sq mi (185.5 km2),0.1 sq mi (0.2 km2),UTC−6 (CST),Harry LaRosiliere,,http://www.theretailconnection.net/uploaded/property/20080813114241164.pdf,"Plano is in the humid subtropical climate zone. The highest recorded temperature was 118°F (48°C) in 1936. On average, the coolest month is January and the warmest is July. The lowest recorded temperature was -7°F (-22°C) in 1930. The maximum average precipitation occurs in May.
","/wiki/Plano,_Texas"
70,Lincoln, Nebraska,"287,401","258,379",+11.23%,92.1 sq mi,238.5 km2,"3,044/sq mi","1,175/km2",92.913 sq mi (240.644 km2),1.354 sq mi (3.507 km2)  1.5%,UTC-6 (CST),Leirion Gaylor Baird,,http://www.lincoln.ne.gov/,"Located on the Great Plains far from the moderating influence of mountains or large bodies of water, Lincoln possesses a highly variable four-season humid continental climate (Köppen Dfa): winters are cold but relatively dry, summers are hot and occasionally humid.[84] With little precipitation falling during winter, precipitation is concentrated in the warmer months, when thunderstorms frequently roll in, often producing tornadoes. Snow averages 25.9 inches (66cm) per season but seasonal accumulation has ranged from 7.2in (18cm) in 1967–68 to 54.3in (138cm) in 1959–60.[85] Snow tends to fall in light amounts, though blizzards are possible. There is an average of 39 days with a snow depth of 1in (2.5cm) or more. The average window for freezing temperatures is October 5 thru April 25, allowing a growing season of 162 days.[85]
","/wiki/Lincoln,_Nebraska"
71,Orlando, Florida,"285,713","238,300",+19.90%,105.2 sq mi,272.5 km2,"2,635/sq mi","1,017/km2",272.51 km2 (105.22 sq mi),22.10 km2 (8.53 sq mi),UTC−5 (Eastern (EST)),Buddy Dyer,"Orlando, like other major cities, experiences gridlock and traffic jams daily, especially when commuting from the northern suburbs in Seminole County south to downtown and from the eastern suburbs of Orange County to Downtown. Heavy traffic is also common in the tourist district south of downtown. Rush hours (peak traffic hours) are usually weekday mornings (after 7am) and afternoons (after 4pm). There are various traffic advisory resources available for commuters including downloading the Tele-Traffic App (available for iPhone and Android), dialing 5-1-1 (a free automated traffic advisory system provided by the Florida Department of Transportation, available by dialing 511), visiting the Florida 511 Web site, listening to traffic reports on major radio stations, and reading electronic traffic advisory displays (also called Variable-message signs, information is also provided by FDOT) on the major highways and roadways.
",http://www.cityoforlando.net,"According to the Köppen climate classification Orlando has a humid subtropical climate like much of the deep southern United States. There are two basic seasons in Orlando, a hot and rainy season, lasting from May until late September (roughly coinciding with the Atlantic hurricane season), and a warm and dry season from October through April.[citation needed] The area's warm and humid climate is caused primarily by its low elevation, its position relatively close to the Tropic of Cancer, and its location in the center of a peninsula. Many characteristics of its climate are a result of its proximity to the Gulf Stream, which flows around the peninsula of Florida.
","/wiki/Orlando,_Florida"
72,Irvine, California,"282,572","212,375",+33.05%,65.6 sq mi,169.9 km2,"4,057/sq mi","1,566/km2",65.58 sq mi (169.86 km2),0.34 sq mi (0.89 km2)  0.52%,UTC−8 (Pacific),City council,,http://cityofirvine.org,"Late spring and early summer in Irvine is subject to the June Gloom phenomenon widespread in southern California, with overcast mornings and occasional drizzle.
Late summer and autumn are warm and mostly dry, with occasional bouts of humid weather extending from Pacific hurricanes off the west coast of Mexico.
Winters are mild, with most winters having no frost, and can be hot and dry when the Santa Ana winds blow. Precipitation in Irvine occurs predominantly during the winter months. Because Irvine is close to the coast, different parts of Irvine have different microclimates; for instance, the June Gloom effect is stronger in the southern parts of Irvine, closer to the Pacific Ocean.
","/wiki/Irvine,_California"
73,Newark, New Jersey,"282,090","277,140",+1.79%,24.1 sq mi,62.4 km2,"11,691/sq mi","4,514/km2",24.187 sq mi (62.644 km2),1.920 sq mi (4.973 km2)  7.35%,UTC−5 (Eastern (EST)),Ras Baraka,,http://newarknj.gov/,"Newark lies in the transition between a humid subtropical and humid continental climate (Köppen Cfa/Dfa), with cold, damp winters and hot, humid summers. The January daily mean is 31.6°F (−0.2°C),[64] and although temperatures below 10°F (−12°C) are to be expected in most years,[65] sub-0°F (−18°C) readings are rare; conversely, some days may warm up to 50°F (10°C). The average seasonal snowfall is 29.5 inches (75cm), though variations in weather patterns may bring sparse snowfall in some years and several major nor'easters in others, with the heaviest 24-hour fall of 25.9 inches (66cm) occurring on December 26, 1947.[64] Spring and autumn in the area are generally unstable yet mild. The July daily mean is 77.4°F (25.2°C), and highs exceed 90°F (32°C) on an average 27 days per year,[64] not factoring in the oft-higher heat index.
","/wiki/Newark,_New_Jersey"
74,Toledo, Ohio,"274,975","287,208",−4.26%,80.7 sq mi,209.0 km2,"3,451/sq mi","1,332/km2",80.69 sq mi (208.99 km2),3.43 sq mi (8.88 km2),UTC−5 (EST),Wade Kapszukiewicz,"Toledo Express Airport, located in the suburbs of Monclova and Swanton Townships, is the primary airport that serves the city. Additionally, Detroit Metropolitan Wayne County Airport is 45 miles north. Toledo Executive Airport (formerly Metcalf Field) is a general aviation airport southeast of Toledo near the I-280 and Ohio SR 795 interchange. Toledo Suburban Airport is another general aviation airport located in Lambertville, MI just north of the state border.
",http://www.toledo.oh.gov,"Toledo, as with much of the Great Lakes region, has a humid continental climate (Köppen Dfa), characterized by four distinct seasons. Lake Erie moderates the climate somewhat, especially in late spring and fall, when air and water temperature differences are maximal. However, this effect is lessened in the winter because Lake Erie (unlike the other Great Lakes) usually freezes over, coupled with prevailing winds that are often westerly. And in the summer, prevailing winds south and west over the lake bring heat and moisture to the city.
","/wiki/Toledo,_Ohio"
75,Durham, North Carolina,"274,291","228,330",+20.13%,109.8 sq mi,284.4 km2,"2,395/sq mi",925/km2,107.4 sq mi (278.1 km2),0.9 sq mi (2.4 km2),UTC−5 (EST),Steve Schewel,,http://durhamnc.gov/,"Durham is classified as a humid subtropical climate (Cfa) according to the Köppen classification, with hot and humid summers, cool winters, and warm to mild spring and autumn. Durham receives abundant precipitation, with thunderstorms common in the summer and temperatures from 80 to 100 degrees F. The region sees an average of 6.8 inches (170mm) of snow per year, which usually melts within a few days.
","/wiki/Durham,_North_Carolina"
76,Chula Vista, California,"271,651","243,916",+11.37%,49.6 sq mi,128.5 km2,"5,387/sq mi","2,080/km2",49.63 sq mi (128.55 km2),2.46 sq mi (6.38 km2)  4.73%,UTC-8 (PST),Mary Casillas Salas,,http://www.chulavistaca.gov,"Like the rest of lowland San Diego County, Chula Vista has a semi-arid climate (Köppen BSh/BSk), with Mediterranean characteristics, though the winter rainfall is too low and erratic to qualify as an actual Mediterranean climate.[99]
","/wiki/Chula_Vista,_California"
77,Fort Wayne, Indiana,"267,633","253,691",+5.50%,110.6 sq mi,286.5 km2,"2,391/sq mi",923/km2,110.63 sq mi (286.52 km2),0.21 sq mi (0.55 km2),UTC−05:00 (EST),Tom Henry,,http://www.cityoffortwayne.org,"Fort Wayne lies in the humid continental climate zone (Köppen: Dfa), experiencing four distinct seasons.[67] The city is located in USDA hardiness zones 5b and 6a.[68] Typically, summers are hot, humid, and wet. Winters are generally cold with moderate snowfall. The average annual precipitation is 37.34in (948mm), recorded at Fort Wayne International Airport. During the winter season, snowfall accumulation averages 33.5in (85cm) per year. Lake-effect snow is not uncommon to the region, but usually appears in the form of light snow flurries.
","/wiki/Fort_Wayne,_Indiana"
78,Jersey City, New Jersey,"265,549","247,597",+7.25%,14.8 sq mi,38.3 km2,"17,848/sq mi","6,891/km2",14.794 sq mi (38.316 km2),6.286 sq mi (16.281 km2)  29.82%,UTC−5 (EST),Steven Fulop,"The Journal Square Transportation Center, Exchange Place and Hoboken Terminal are major origination/destination points for buses. Service is available to numerous points in Jersey City, Hudson County, and some suburban areas as well as to Newark on the 1, 2, 6, 10, 22, 64, 67, 68, 80, 81, 82, 83, 84, 85, 86, 87, 88, 123, 125, 305, 319 lines.[287] Also serving Jersey City are various lines operated by Academy Bus and A&C Bus. Increased use of jitneys, locally known as dollar vans, have greatly affected travel patterns in Hudson County, leading to decreased bus ridership on traditional bus lines. After studies examining existing systems and changes in public transportation usage patterns it was determined that a Journal Square-Bayonne bus rapid transit system should be investigated. In 2012, the Board of Chosen Freeholders authorized the identification of possible BRT corridors.[288][289][290][291][292]
",http://www.jerseycitynj.gov,"The climate in this area is characterized by hot, humid summers and generally mild to cool winters.  According to the Köppen climate classification system, Jersey City has a humid subtropical climate, abbreviated ""Cfa"" on climate maps.[93] Jersey City is in USDA hardiness zone 7a on the west side of the city and hardiness zone 7b on the east side.
","/wiki/Jersey_City,_New_Jersey"
